{"cases":[{"acceptable_asset_ids":["github:add_comment_to_pending_review","github:add_issue_comment","github:add_pull_request_review_comment"],"authorship":"generated","conversation":[],"id":"ambiguous-comments","lane":"en_to_en","notes":"The request explicitly leaves a capability choice unresolved. Multiple source-backed alternatives are acceptable; confident automatic commitment is inappropriate. No actual user choice is invented.","query_language":"en","reference_class":"ambiguous","reference_evidence_ids":["original:381caefbabbf8588fc82bf3ab3937b4f23c1449e3518ad5a4dcf84a9281f7306","original:652d78887307132442e191ff27618b37904a0fd52a65e312556a44ed6d45842f","original:c6733346db7f86297cd902c72762fc3b62c5fc50b8d32639943bc1599acbbfc5"],"reference_kind":"author_defined","requested_kinds":["mcp_tool","skill"],"source_asset_ids":["github:add_comment_to_pending_review","github:add_issue_comment","github:add_pull_request_review_comment"],"source_evidence_ids":["original:381caefbabbf8588fc82bf3ab3937b4f23c1449e3518ad5a4dcf84a9281f7306","original:652d78887307132442e191ff27618b37904a0fd52a65e312556a44ed6d45842f","original:c6733346db7f86297cd902c72762fc3b62c5fc50b8d32639943bc1599acbbfc5"],"task_text":"Add a comment to this pull request; I have not decided whether it should be a general thread comment or part of a pending code review."},{"acceptable_asset_ids":["matrix:6a2109c15f61584597413c46","matrix:6a210a26836052485d3fe6be"],"authorship":"generated","conversation":[],"id":"ambiguous-crash","lane":"zh_hans_to_zh_hans","notes":"The request explicitly leaves a capability choice unresolved. Multiple source-backed alternatives are acceptable; confident automatic commitment is inappropriate. No actual user choice is invented.","query_language":"zh","reference_class":"ambiguous","reference_evidence_ids":["original:20e73552394f97863803ced496f34a3a4663f14331f5b453d4c2c248ffc13312","original:f5e24b234ad087ccc36517a4a5f430ed248a5fe8fca1e96922a87a7a5143e737"],"reference_kind":"author_defined","requested_kinds":["mcp_tool","skill"],"source_asset_ids":["matrix:6a2109c15f61584597413c46","matrix:6a210a26836052485d3fe6be"],"source_evidence_ids":["original:20e73552394f97863803ced496f34a3a4663f14331f5b453d4c2c248ffc13312","original:f5e24b234ad087ccc36517a4a5f430ed248a5fe8fca1e96922a87a7a5143e737"],"task_text":"鸿蒙应用崩溃了，尚未确定发生在原生层还是脚本层。"},{"acceptable_asset_ids":["skillsbench:ac9c97ded8b50465fad72cb7","skillsbench:f545b132b4beb3dc193acfa8"],"authorship":"generated","conversation":[],"id":"ambiguous-keyframe","lane":"zh_hans_to_en","notes":"The request explicitly leaves a capability choice unresolved. Multiple source-backed alternatives are acceptable; confident automatic commitment is inappropriate. No actual user choice is invented.","query_language":"zh","reference_class":"ambiguous","reference_evidence_ids":["original:67d169e60ca71c40cd3aca75b8f6ca6d9dba8ba64fa4b15eb6ef50880f84e92e","original:b8109889c9b72953b52c55d17d0fa1d6f1083f6a6d1d378cdda6b6509c38fa18"],"reference_kind":"author_defined","requested_kinds":["mcp_tool","skill"],"source_asset_ids":["skillsbench:ac9c97ded8b50465fad72cb7","skillsbench:f545b132b4beb3dc193acfa8"],"source_evidence_ids":["original:67d169e60ca71c40cd3aca75b8f6ca6d9dba8ba64fa4b15eb6ef50880f84e92e","original:b8109889c9b72953b52c55d17d0fa1d6f1083f6a6d1d378cdda6b6509c38fa18"],"task_text":"从视频中提取图像供检查，我还没有决定按时间抽帧还是只取编码关键帧。"},{"acceptable_asset_ids":["matrix:6a15c2573a79e364c8d3b6ef","matrix:6a15c4343a79e364c8d3b6f8"],"authorship":"generated","conversation":[],"id":"ambiguous-layout","lane":"en_to_en","notes":"The request explicitly leaves a capability choice unresolved. Multiple source-backed alternatives are acceptable; confident automatic commitment is inappropriate. No actual user choice is invented.","query_language":"en","reference_class":"ambiguous","reference_evidence_ids":["original:8aa11164227a1dfee5d66a42b26d7e6827da24dd3ce2db64273f5d5dea4c5162","original:c60b88467b4092349a4defd9f91bac9326243d1c2b7a92dc4adcf765622e25e1"],"reference_kind":"author_defined","requested_kinds":["mcp_tool","skill"],"source_asset_ids":["matrix:6a15c2573a79e364c8d3b6ef","matrix:6a15c4343a79e364c8d3b6f8"],"source_evidence_ids":["original:8aa11164227a1dfee5d66a42b26d7e6827da24dd3ce2db64273f5d5dea4c5162","original:c60b88467b4092349a4defd9f91bac9326243d1c2b7a92dc4adcf765622e25e1"],"task_text":"Help adapt a HarmonyOS page layout; I have not decided whether this concerns window width or system safe areas."},{"acceptable_asset_ids":["github:get_notification_details","github:list_notifications"],"authorship":"generated","conversation":[],"id":"ambiguous-notifications","lane":"code_switch","notes":"The request explicitly leaves a capability choice unresolved. Multiple source-backed alternatives are acceptable; confident automatic commitment is inappropriate. No actual user choice is invented.","query_language":"mixed","reference_class":"ambiguous","reference_evidence_ids":["original:9809077c7d0bf085ffa99c1d25fac799a3d584f3b9328f4a51be5ce2eea41ff0","original:f533ee26b58f2f5b6018a208bc15e4f9cef7097563183c5e88ccaaa22ea999e6"],"reference_kind":"author_defined","requested_kinds":["mcp_tool","skill"],"source_asset_ids":["github:get_notification_details","github:list_notifications"],"source_evidence_ids":["original:9809077c7d0bf085ffa99c1d25fac799a3d584f3b9328f4a51be5ce2eea41ff0","original:f533ee26b58f2f5b6018a208bc15e4f9cef7097563183c5e88ccaaa22ea999e6"],"task_text":"请处理 GitHub notifications；尚未决定读取单条详情还是列出通知。"},{"acceptable_asset_ids":["matrix:6a2a351befaf3913a71c5451","matrix:6a2a3541587f977f23cd00a9"],"authorship":"generated","conversation":[],"id":"ambiguous-scan","lane":"zh_hans_to_zh_hans","notes":"The request explicitly leaves a capability choice unresolved. Multiple source-backed alternatives are acceptable; confident automatic commitment is inappropriate. No actual user choice is invented.","query_language":"zh","reference_class":"ambiguous","reference_evidence_ids":["original:7c158f152ee126113fb1c934cd323fccec31f714dffcba7ef104b691b85161e2","original:ad19aa4d5dc322d09bc502777685b934e2d94aea65f4e2550c7e307f5f5c742c"],"reference_kind":"author_defined","requested_kinds":["mcp_tool","skill"],"source_asset_ids":["matrix:6a2a351befaf3913a71c5451","matrix:6a2a3541587f977f23cd00a9"],"source_evidence_ids":["original:7c158f152ee126113fb1c934cd323fccec31f714dffcba7ef104b691b85161e2","original:ad19aa4d5dc322d09bc502777685b934e2d94aea65f4e2550c7e307f5f5c742c"],"task_text":"鸿蒙应用要接入扫码能力，但还没有决定用默认页面还是自定义相机页面。"},{"acceptable_asset_ids":["matrix:6a10873ea4482462bc6264fa"],"authorship":"generated","conversation":[],"id":"capability-01-en","lane":"en_to_en","notes":"Preregistered author-defined capability reference from retained original and description. All412 assets remain offered; source tags are not independently reviewed semantic families. No independent human annotation or exhaustive relevance review.","query_language":"en","reference_class":"positive","reference_evidence_ids":["original:557af88dcb9c691553386ae53f16751a802183470953b57189876b4a52dc544c"],"reference_kind":"author_defined","requested_kinds":["mcp_tool","skill"],"source_asset_ids":["matrix:6a10873ea4482462bc6264fa"],"source_evidence_ids":["original:557af88dcb9c691553386ae53f16751a802183470953b57189876b4a52dc544c"],"task_text":"Statically inspect HarmonyOS source code for objects that remain referenced and suggest memory-leak fixes."},{"acceptable_asset_ids":["matrix:6a10873ea4482462bc6264fa"],"authorship":"generated","conversation":[],"id":"capability-01-zh","lane":"zh_hans_to_en","notes":"Preregistered author-defined capability reference from retained original and description. All412 assets remain offered; source tags are not independently reviewed semantic families. No independent human annotation or exhaustive relevance review.","query_language":"zh","reference_class":"positive","reference_evidence_ids":["original:557af88dcb9c691553386ae53f16751a802183470953b57189876b4a52dc544c"],"reference_kind":"author_defined","requested_kinds":["mcp_tool","skill"],"source_asset_ids":["matrix:6a10873ea4482462bc6264fa"],"source_evidence_ids":["original:557af88dcb9c691553386ae53f16751a802183470953b57189876b4a52dc544c"],"task_text":"检查鸿蒙应用源代码中可能导致对象无法释放的路径，并给出内存泄漏的修复建议。"},{"acceptable_asset_ids":["matrix:69e1df16a8edf53fea151e71"],"authorship":"generated","conversation":[],"id":"capability-02-en","lane":"en_to_zh_hans","notes":"Preregistered author-defined capability reference from retained original and description. All412 assets remain offered; source tags are not independently reviewed semantic families. No independent human annotation or exhaustive relevance review.","query_language":"en","reference_class":"positive","reference_evidence_ids":["original:f22580d0e98acf24ca94be5bd925b9af9b4beeb7064279396e80bc62fc616a90"],"reference_kind":"author_defined","requested_kinds":["mcp_tool","skill"],"source_asset_ids":["matrix:69e1df16a8edf53fea151e71"],"source_evidence_ids":["original:f22580d0e98acf24ca94be5bd925b9af9b4beeb7064279396e80bc62fc616a90"],"task_text":"Migrate HarmonyOS ArkUI state management from V1 to V2, including decorators and data synchronization."},{"acceptable_asset_ids":["matrix:69e1df16a8edf53fea151e71"],"authorship":"generated","conversation":[],"id":"capability-02-zh","lane":"zh_hans_to_zh_hans","notes":"Preregistered author-defined capability reference from retained original and description. All412 assets remain offered; source tags are not independently reviewed semantic families. No independent human annotation or exhaustive relevance review.","query_language":"zh","reference_class":"positive","reference_evidence_ids":["original:f22580d0e98acf24ca94be5bd925b9af9b4beeb7064279396e80bc62fc616a90"],"reference_kind":"author_defined","requested_kinds":["mcp_tool","skill"],"source_asset_ids":["matrix:69e1df16a8edf53fea151e71"],"source_evidence_ids":["original:f22580d0e98acf24ca94be5bd925b9af9b4beeb7064279396e80bc62fc616a90"],"task_text":"把鸿蒙界面项目的第一代状态管理迁移到第二代，说明组件装饰器和数据同步的替换步骤。"},{"a